[
  {
    "email": "bob_stone@factorial.co",
    "first_name": "Bob",
    "last_name": "Stone",
    "birthday_on": "1988-04-12",
    "role": "basic",
    "gender": "male",
    "nationality": "ES",
    "country": "ES",
    "city": "Barcelona",
    "state": "Catalonia",
    "postal_code": "08001",
    "address_line_1": "Carrer de Pallars 99",
    "company_id": 5,
    "legal_entity_id": 5,
    "manager_id": 12,
    "timeoff_manager_id": 12
  },
  {
    "email": "ana.lopez@factorial.co",
    "first_name": "Ana",
    "last_name": "Lopez",
    "birthday_on": "1992-09-30",
    "role": "admin",
    "gender": "female",
    "nationality": "ES",
    "country": "ES",
    "city": "Madrid",
    "state": "Madrid",
    "postal_code": "28001",
    "company_id": 5,
    "legal_entity_id": 5
  }
]
